{
  "$schema": "https://json-schema.org/draft/2020-12/schema",
  "$id": "https://digitallyconnected.net/schemas/dc-003/engineering-work-order.schema.json",
  "title": "Engineering Work Order",
  "description": "DC-003-I029 — one approved engineering task, authored by the Strategy Office. Replaces an informal markdown milestone brief with a structured, permanent repository object. This schema intentionally supports every status a future milestone (the Bridge Layer) may need to set directly — DC-003-I029's own CLI (`npm run engineering -- work create`) only ever creates a Work Order with status 'draft' or 'ready', per its own brief's explicit 'do not invent workflow transitions' instruction; 'in_progress'/'completed'/'approved'/'archived' exist in this enum for forward compatibility, not because this milestone's own CLI produces them.",
  "type": "object",
  "required": [
    "work_order_id",
    "milestone",
    "title",
    "objective",
    "repository_commit",
    "constraints",
    "review_criteria",
    "created_at",
    "approved_at",
    "status",
    "priority",
    "dependencies",
    "notes"
  ],
  "additionalProperties": false,
  "properties": {
    "work_order_id": { "type": "string", "pattern": "^wo_[A-Za-z0-9]+$" },
    "milestone": { "type": "string", "pattern": "^DC-003-I[0-9]+(\\.[0-9]+)?$" },
    "title": { "type": "string", "minLength": 1 },
    "objective": { "type": "string", "minLength": 1 },
    "repository_commit": {
      "type": ["string", "null"],
      "pattern": "^[0-9a-f]{7,40}$",
      "description": "The repository commit this Work Order was authored against (its own 'starting point'), or null if genuinely unknown at authoring time. Never the commit the resulting delivery produces — that belongs on the Engineering Delivery Report."
    },
    "constraints": { "type": "array", "items": { "type": "string", "minLength": 1 } },
    "review_criteria": {
      "type": "array",
      "minItems": 1,
      "items": { "type": "string", "minLength": 1 },
      "description": "The Strategy Office's own numbered review checklist for this task — every milestone brief in this project's history has included one; this field makes it a structured, queryable list instead of markdown prose."
    },
    "created_at": { "type": "string", "format": "date-time" },
    "approved_at": {
      "type": ["string", "null"],
      "format": "date-time",
      "description": "Set only once the Strategy Office has approved this task to begin — null for 'draft', required for every other status. Approval is never automated by this repository (see README 'Status Model')."
    },
    "status": {
      "type": "string",
      "enum": ["draft", "ready", "in_progress", "completed", "approved", "archived"]
    },
    "priority": { "type": "string", "enum": ["low", "medium", "high"] },
    "dependencies": {
      "type": "array",
      "items": { "type": "string", "pattern": "^wo_[A-Za-z0-9]+$" },
      "description": "Other Work Order IDs this one depends on. Referential integrity (that a referenced ID actually exists) is a store/service-layer concern, not enforced by this schema."
    },
    "notes": { "type": ["string", "null"] }
  },
  "oneOf": [
    {
      "properties": { "status": { "const": "draft" }, "approved_at": { "type": "null" } },
      "required": ["status", "approved_at"]
    },
    {
      "properties": {
        "status": { "enum": ["ready", "in_progress", "completed", "approved", "archived"] },
        "approved_at": { "type": "string", "format": "date-time" }
      },
      "required": ["status", "approved_at"]
    }
  ]
}
