{
  "work_order_id": "wo_9c026a104e3745c3",
  "milestone": "DC-003-I029",
  "title": "Engineering Work Management",
  "objective": "Formalise communication between the Strategy Office and Delivery Office using structured engineering objects instead of informal markdown.",
  "repository_commit": "7d88509",
  "constraints": ["No Claude integration", "No ChatGPT integration", "No MCP", "No n8n", "No networking"],
  "review_criteria": [
    "Engineering Work Orders are immutable",
    "Engineering Delivery Reports are immutable",
    "Stores mirror repository conventions",
    "Status derives from repository evidence",
    "Control Centre remains read-only"
  ],
  "created_at": "2026-08-05T10:00:00Z",
  "approved_at": "2026-08-05T10:05:00Z",
  "status": "ready",
  "priority": "high",
  "dependencies": [],
  "notes": null
}
